{"$schema":"https://json-schema.org/draft/2020-12/schema","$id":"orchestrator-engine://schemas/metrics-guidance","title":"Metrics guidance","schema_version":1,"kind":"ORCHESTRATOR_METRICS_GUIDANCE","type":"object","required":["schema_version","kind","guidance_snapshot_id","created_at","as_of","status","scope","next_action","reason","pending_obligations","authority","details"],"properties":{"schema_version":{"const":1},"kind":{"const":"ORCHESTRATOR_METRICS_GUIDANCE"},"guidance_snapshot_id":{"type":"string","pattern":"^[0-9a-f]{64}$"},"created_at":{"type":"string","format":"date-time"},"as_of":{"type":"string","format":"date-time"},"status":{"enum":["available","partial","unavailable"]},"scope":{"enum":["package","operation_only"]},"next_action":{"type":"string","minLength":1},"reason":{"type":"string","minLength":1},"pending_obligations":{"type":"array"},"authority":{"const":"advisory_only"},"details":{"type":"object"}},"additionalProperties":false}
