{"schema_version":1,"kind":"ORCHESTRATOR_METRICS_GUIDANCE","guidance_snapshot_id":"aaaaaaaaaaaaaaaaaaaaaaaaaaaaaaaaaaaaaaaaaaaaaaaaaaaaaaaaaaaaaaaa","created_at":"2026-09-08T10:04:00Z","as_of":"2026-09-08T10:04:00Z","status":"available","scope":"operation_only","next_action":"handoff_operation_result","reason":"operation_evidence_complete","pending_obligations":[],"authority":"advisory_only","details":{}}
